{
  "datasets": [
    {
      "citations": [
        {
          "line_numbers": [
            57,
            58,
            59,
            60,
            61,
            62,
            63,
            64,
            65,
            66,
            67,
            68,
            69,
            70,
            71,
            72,
            73,
            74,
            75,
            76,
            77,
            78,
            79,
            80,
            81,
            82,
            83,
            84,
            85,
            86,
            87,
            88
          ],
          "path": "evidence/numerical/metric_convergence_rows.jsonl",
          "selector": "design=ray_convergence; grid_delta=0.01; rng_seed=53000..53007",
          "sha256": "2bd28daaf30be854678445567260c91e7891106a44ce233a1d96971eb0d81863"
        }
      ],
      "comparison_type": "Successive ray refinement; no level is treated as truth.",
      "id": "same_recipe_ray_ladder",
      "levels": [
        {
          "between_seed_spread": {
            "cd_bottom": {
              "count": 8,
              "maximum": 0.3124555398137319,
              "median": 0.3105673985391054,
              "minimum": 0.30998419904448715,
              "p10": 0.3101212387766379,
              "p90": 0.31181649113817295,
              "sample_sd": 0.0008313377460940297
            },
            "cd_middle": {
              "count": 8,
              "maximum": 0.32384663695423516,
              "median": 0.3204814458025479,
              "minimum": 0.3199812949615109,
              "p10": 0.32001283962879845,
              "p90": 0.32256875280842756,
              "sample_sd": 0.0013198019198230584
            },
            "cd_top": {
              "count": 8,
              "maximum": 0.33740817358565117,
              "median": 0.3364346841967435,
              "minimum": 0.3353584385037431,
              "p10": 0.33542059832051624,
              "p90": 0.3372976187026794,
              "sample_sd": 0.0007529068714992342
            },
            "depth": {
              "count": 8,
              "maximum": 1.2438121197364282,
              "median": 1.2353669198902157,
              "minimum": 1.23,
              "p10": 1.2306455221534294,
              "p90": 1.2421381438870438,
              "sample_sd": 0.004740301407182188
            },
            "max_bow": {
              "count": 8,
              "maximum": 0.0117108280497831,
              "median": 0.010702814130701496,
              "minimum": 0.009418299138167024,
              "p10": 0.010037049545453508,
              "p90": 0.011676232670976658,
              "sample_sd": 0.0007795061825820442
            }
          },
          "change_from_previous_level": null,
          "latency_s": {
            "count": 8,
            "maximum": 15.012526035308838,
            "median": 12.269564628601074,
            "minimum": 10.504582166671753,
            "p10": 10.523211097717285,
            "p90": 14.883966183662412,
            "sample_sd": 2.0242232951861974
          },
          "rays_per_point": 250,
          "run_count": 8
        },
        {
          "between_seed_spread": {
            "cd_bottom": {
              "count": 8,
              "maximum": 0.3138397326352932,
              "median": 0.31161922320618646,
              "minimum": 0.31015046839678817,
              "p10": 0.31038265326181763,
              "p90": 0.3128095896427086,
              "sample_sd": 0.0012105183657732117
            },
            "cd_middle": {
              "count": 8,
              "maximum": 0.32464855100624296,
              "median": 0.3209863002686851,
              "minimum": 0.319234492005289,
              "p10": 0.31974481148623757,
              "p90": 0.32276278374699435,
              "sample_sd": 0.0017015680015276037
            },
            "cd_top": {
              "count": 8,
              "maximum": 0.3381241812626621,
              "median": 0.3373344567261538,
              "minimum": 0.33562989438666335,
              "p10": 0.33593962699299196,
              "p90": 0.33805697512168986,
              "sample_sd": 0.0009151497231044634
            },
            "depth": {
              "count": 8,
              "maximum": 1.2460543618680526,
              "median": 1.2385035822859392,
              "minimum": 1.233907806723497,
              "p10": 1.234496560280436,
              "p90": 1.2434993211535024,
              "sample_sd": 0.004188900422564467
            },
            "max_bow": {
              "count": 8,
              "maximum": 0.011723552006512733,
              "median": 0.010577533309545945,
              "minimum": 0.00968343320600637,
              "p10": 0.009889822201847004,
              "p90": 0.01158628497927123,
              "sample_sd": 0.000751826807294853
            }
          },
          "change_from_previous_level": {
            "from_rays": 250,
            "paired_absolute_change": {
              "cd_bottom": {
                "count": 8,
                "maximum": 0.003659762544876377,
                "median": 0.000897792837465522,
                "minimum": 0.00033344697275389246,
                "p10": 0.0003626149932312528,
                "p90": 0.0027666592844425683,
                "sample_sd": 0.0012007435189602931
              },
              "cd_middle": {
                "count": 8,
                "maximum": 0.004622192234321254,
                "median": 0.0007297986486472507,
                "minimum": 8.479309698267157e-05,
                "p10": 0.00017266859629625487,
                "p90": 0.0027110850931395085,
                "sample_sd": 0.0014770066356832824
              },
              "cd_top": {
                "count": 8,
                "maximum": 0.0026697339861015412,
                "median": 0.000905693503922278,
                "minimum": 0.00011262781012111311,
                "p10": 0.00032303326614213645,
                "p90": 0.0021915987678883305,
                "sample_sd": 0.0008362109023818559
              },
              "depth": {
                "count": 8,
                "maximum": 0.011811319297154066,
                "median": 0.002910529295793829,
                "minimum": 0.0009835780385305526,
                "p10": 0.0018871674408030836,
                "p90": 0.007539032261548505,
                "sample_sd": 0.0034028607106179054
              },
              "max_bow": {
                "count": 8,
                "maximum": 0.002027394843776731,
                "median": 0.0007337575751924091,
                "minimum": 0.00032395366279758253,
                "p10": 0.0003242289323908548,
                "p90": 0.001502209673906432,
                "sample_sd": 0.000583076126990038
              }
            },
            "ratio_of_median_latencies": 2.209802367108308,
            "to_rays": 1000
          },
          "latency_s": {
            "count": 8,
            "maximum": 28.3355610370636,
            "median": 27.11331295967102,
            "minimum": 24.648253202438354,
            "p10": 25.734863018989564,
            "p90": 27.945719003677368,
            "sample_sd": 1.173128471761437
          },
          "rays_per_point": 1000,
          "run_count": 8
        },
        {
          "between_seed_spread": {
            "cd_bottom": {
              "count": 8,
              "maximum": 0.3137380944421133,
              "median": 0.31255654568912683,
              "minimum": 0.3113967686093781,
              "p10": 0.3118108935677116,
              "p90": 0.3137083543354286,
              "sample_sd": 0.0008911756536017039
            },
            "cd_middle": {
              "count": 8,
              "maximum": 0.3239979716909003,
              "median": 0.3224443935233412,
              "minimum": 0.3200660221533505,
              "p10": 0.32089918083972596,
              "p90": 0.3238617819605898,
              "sample_sd": 0.0013491085180739387
            },
            "cd_top": {
              "count": 8,
              "maximum": 0.33740625297106036,
              "median": 0.3362904456949143,
              "minimum": 0.3356935145504396,
              "p10": 0.3359154703296755,
              "p90": 0.33678971420379206,
              "sample_sd": 0.0005060620600579188
            },
            "depth": {
              "count": 8,
              "maximum": 1.2449970251969145,
              "median": 1.2431242565328104,
              "minimum": 1.239946776818592,
              "p10": 1.2399840330455776,
              "p90": 1.244468433449717,
              "sample_sd": 0.001876208309921162
            },
            "max_bow": {
              "count": 8,
              "maximum": 0.011526088361902193,
              "median": 0.010136248419472041,
              "minimum": 0.00945816944239089,
              "p10": 0.00950447359589134,
              "p90": 0.0109298250495217,
              "sample_sd": 0.000679229629565793
            }
          },
          "change_from_previous_level": {
            "from_rays": 1000,
            "paired_absolute_change": {
              "cd_bottom": {
                "count": 8,
                "maximum": 0.0029992937223705662,
                "median": 0.0008382169538926065,
                "minimum": 0.00016194348777492928,
                "p10": 0.00018619734333947258,
                "p90": 0.002562783812510566,
                "sample_sd": 0.0011472713995644482
              },
              "cd_middle": {
                "count": 8,
                "maximum": 0.0037754323427235947,
                "median": 0.0009578373475000734,
                "minimum": 0.0002664012938392579,
                "p10": 0.0004032249300292279,
                "p90": 0.002790699450085765,
                "sample_sd": 0.0012080178146837192
              },
              "cd_top": {
                "count": 8,
                "maximum": 0.002113587027599728,